[
  {"category":"narrative_source_definition","id":"source_phia_marker_1","schema_version":1,"name_key":"SOURCE_PHIA_MARKER_1_NAME","description_key":"SOURCE_PHIA_MARKER_1_DESC","availability":["LAUNCH","EXPANSION"],"tags":["launch","narrative"],"compatibility":{},"effects":{},"source_kind":"phia_marker","sequence":1,"source_receipt_id":"phia_marker_1","floor_id":"floor_ruins_of_remnant","location_id":"phia_marker_broken_gate","requirements":[],"text_key":"SOURCE_PHIA_MARKER_1_TEXT","consumption_scope":"profile"},
  {"category":"narrative_source_definition","id":"source_phia_marker_2","schema_version":1,"name_key":"SOURCE_PHIA_MARKER_2_NAME","description_key":"SOURCE_PHIA_MARKER_2_DESC","availability":["LAUNCH","EXPANSION"],"tags":["launch","narrative"],"compatibility":{},"effects":{},"source_kind":"phia_marker","sequence":2,"source_receipt_id":"phia_marker_2","floor_id":"floor_ruins_of_remnant","location_id":"phia_marker_warden_stairs","requirements":[],"text_key":"SOURCE_PHIA_MARKER_2_TEXT","consumption_scope":"profile"},
  {"category":"narrative_source_definition","id":"source_phia_marker_3","schema_version":1,"name_key":"SOURCE_PHIA_MARKER_3_NAME","description_key":"SOURCE_PHIA_MARKER_3_DESC","availability":["LAUNCH","EXPANSION"],"tags":["launch","narrative"],"compatibility":{},"effects":{},"source_kind":"phia_marker","sequence":3,"source_receipt_id":"phia_marker_3","floor_id":"floor_ruins_of_remnant","location_id":"phia_marker_amplifier_walk","requirements":[],"text_key":"SOURCE_PHIA_MARKER_3_TEXT","consumption_scope":"profile"},
  {"category":"narrative_source_definition","id":"source_phia_marker_4","schema_version":1,"name_key":"SOURCE_PHIA_MARKER_4_NAME","description_key":"SOURCE_PHIA_MARKER_4_DESC","availability":["LAUNCH","EXPANSION"],"tags":["launch","narrative"],"compatibility":{},"effects":{},"source_kind":"phia_marker","sequence":4,"source_receipt_id":"phia_marker_4","floor_id":"floor_ruins_of_remnant","location_id":"phia_marker_memory_bridge","requirements":[],"text_key":"SOURCE_PHIA_MARKER_4_TEXT","consumption_scope":"profile"},
  {"category":"narrative_source_definition","id":"source_phia_marker_5","schema_version":1,"name_key":"SOURCE_PHIA_MARKER_5_NAME","description_key":"SOURCE_PHIA_MARKER_5_DESC","availability":["LAUNCH","EXPANSION"],"tags":["launch","narrative"],"compatibility":{},"effects":{},"source_kind":"phia_marker","sequence":5,"source_receipt_id":"phia_marker_5","floor_id":"floor_ruins_of_remnant","location_id":"phia_marker_heart_approach","requirements":[],"text_key":"SOURCE_PHIA_MARKER_5_TEXT","consumption_scope":"profile"},
  {"category":"narrative_source_definition","id":"source_walker_letter_1","schema_version":1,"name_key":"SOURCE_WALKER_LETTER_1_NAME","description_key":"SOURCE_WALKER_LETTER_1_DESC","availability":["LAUNCH","EXPANSION"],"tags":["launch","narrative"],"compatibility":{},"effects":{},"source_kind":"walker_letter","sequence":1,"source_receipt_id":"walker_letter_1","floor_id":"floor_ruins_of_remnant","location_id":"walker_letter_warden_locker","requirements":[],"text_key":"SOURCE_WALKER_LETTER_1_TEXT","consumption_scope":"profile"},
  {"category":"narrative_source_definition","id":"source_walker_letter_2","schema_version":1,"name_key":"SOURCE_WALKER_LETTER_2_NAME","description_key":"SOURCE_WALKER_LETTER_2_DESC","availability":["LAUNCH","EXPANSION"],"tags":["launch","narrative"],"compatibility":{},"effects":{},"source_kind":"walker_letter","sequence":2,"source_receipt_id":"walker_letter_2","floor_id":"floor_void_forest","location_id":"walker_letter_dawn_camp","requirements":[],"text_key":"SOURCE_WALKER_LETTER_2_TEXT","consumption_scope":"profile"},
  {"category":"narrative_source_definition","id":"source_walker_letter_3","schema_version":1,"name_key":"SOURCE_WALKER_LETTER_3_NAME","description_key":"SOURCE_WALKER_LETTER_3_DESC","availability":["LAUNCH","EXPANSION"],"tags":["launch","narrative"],"compatibility":{},"effects":{},"source_kind":"walker_letter","sequence":3,"source_receipt_id":"walker_letter_3","floor_id":"floor_plane_forge","location_id":"walker_letter_last_workbench","requirements":[],"text_key":"SOURCE_WALKER_LETTER_3_TEXT","consumption_scope":"profile"},
  {"category":"narrative_source_definition","id":"source_heart_fragment_1","schema_version":1,"name_key":"SOURCE_HEART_FRAGMENT_1_NAME","description_key":"SOURCE_HEART_FRAGMENT_1_DESC","availability":["LAUNCH","EXPANSION"],"tags":["launch","narrative"],"compatibility":{},"effects":{},"source_kind":"heart_fragment","sequence":1,"source_receipt_id":"heart_fragment_1","floor_id":"floor_ruins_of_remnant","location_id":"heart_fragment_ruin_king","requirements":[{"kind":"boss_defeated","id":"ruin_king","value":1}],"text_key":"SOURCE_HEART_FRAGMENT_1_TEXT","consumption_scope":"profile"},
  {"category":"narrative_source_definition","id":"source_heart_fragment_2","schema_version":1,"name_key":"SOURCE_HEART_FRAGMENT_2_NAME","description_key":"SOURCE_HEART_FRAGMENT_2_DESC","availability":["LAUNCH","EXPANSION"],"tags":["launch","narrative"],"compatibility":{},"effects":{},"source_kind":"heart_fragment","sequence":2,"source_receipt_id":"heart_fragment_2","floor_id":"floor_void_forest","location_id":"heart_fragment_forest_heart","requirements":[{"kind":"boss_defeated","id":"forest_heart","value":1}],"text_key":"SOURCE_HEART_FRAGMENT_2_TEXT","consumption_scope":"profile"},
  {"category":"narrative_source_definition","id":"source_heart_fragment_3","schema_version":1,"name_key":"SOURCE_HEART_FRAGMENT_3_NAME","description_key":"SOURCE_HEART_FRAGMENT_3_DESC","availability":["LAUNCH","EXPANSION"],"tags":["launch","narrative"],"compatibility":{},"effects":{},"source_kind":"heart_fragment","sequence":3,"source_receipt_id":"heart_fragment_3","floor_id":"floor_time_rift","location_id":"heart_fragment_time_sovereign","requirements":[{"kind":"boss_defeated","id":"time_sovereign","value":1}],"text_key":"SOURCE_HEART_FRAGMENT_3_TEXT","consumption_scope":"profile"},
  {"category":"narrative_source_definition","id":"source_heart_fragment_4","schema_version":1,"name_key":"SOURCE_HEART_FRAGMENT_4_NAME","description_key":"SOURCE_HEART_FRAGMENT_4_DESC","availability":["LAUNCH","EXPANSION"],"tags":["launch","narrative"],"compatibility":{},"effects":{},"source_kind":"heart_fragment","sequence":4,"source_receipt_id":"heart_fragment_4","floor_id":"floor_plane_forge","location_id":"heart_fragment_forge_colossus","requirements":[{"kind":"boss_defeated","id":"forge_colossus","value":1}],"text_key":"SOURCE_HEART_FRAGMENT_4_TEXT","consumption_scope":"profile"},
  {"category":"narrative_source_definition","id":"source_heart_fragment_5","schema_version":1,"name_key":"SOURCE_HEART_FRAGMENT_5_NAME","description_key":"SOURCE_HEART_FRAGMENT_5_DESC","availability":["LAUNCH","EXPANSION"],"tags":["launch","narrative"],"compatibility":{},"effects":{},"source_kind":"heart_fragment","sequence":5,"source_receipt_id":"heart_fragment_5","floor_id":"floor_throne_of_void","location_id":"heart_fragment_void_throne","requirements":[{"kind":"boss_defeated","id":"void_throne","value":1}],"text_key":"SOURCE_HEART_FRAGMENT_5_TEXT","consumption_scope":"profile"}
]
